{
  "$schema": "https://json-schema.org/draft/2020-12/schema", "$id": "https://openai.local/compass-builder/benchmark-receipt.schema.json",
  "title": "Compass Builder benchmark receipt v1", "type": "object", "additionalProperties": false,
  "required": ["schemaVersion", "workloadId", "attemptId", "arm", "pairNumber", "trialNumber", "warmup", "controls", "startedAt", "endedAt", "elapsedMs", "metrics", "eventLedger", "finalGreenSha", "terminalStatus"],
  "allOf": [
    {"if": {"properties": {"warmup": {"const": true}}}, "then": {"properties": {"pairNumber": {"const": 0}, "trialNumber": {"const": 0}}}, "else": {"properties": {"pairNumber": {"minimum": 1}, "trialNumber": {"minimum": 1}}}},
    {"if": {"properties": {"terminalStatus": {"const": "green"}}}, "then": {"properties": {"finalGreenSha": {"$ref": "#/$defs/sha"}, "metrics": {"properties": {"conflictsUnresolved": {"const": 0}, "scopeViolations": {"const": 0}, "staleHeadEvents": {"const": 0}, "timeouts": {"const": 0}}}}}, "else": {"properties": {"finalGreenSha": {"type": "null"}}}},
    {"if": {"properties": {"terminalStatus": {"const": "timed-out"}}}, "then": {"properties": {"metrics": {"properties": {"timeouts": {"minimum": 1}}}}}}
  ],
  "properties": {
    "schemaVersion": {"const": "compass-builder.benchmark-receipt.v1"}, "workloadId": {"$ref": "#/$defs/id"}, "attemptId": {"$ref": "#/$defs/id"}, "arm": {"enum": ["sequential", "parallel"]}, "pairNumber": {"type": "integer", "minimum": 0}, "trialNumber": {"type": "integer", "minimum": 0}, "warmup": {"type": "boolean"},
    "controls": {"$ref": "#/$defs/controls"}, "startedAt": {"type": "string", "format": "date-time", "maxLength": 64, "pattern": "^\\d{4}-\\d{2}-\\d{2}T\\d{2}:\\d{2}:\\d{2}(?:\\.\\d+)?(?:Z|[+-]\\d{2}:\\d{2})$"}, "endedAt": {"type": "string", "format": "date-time", "maxLength": 64, "pattern": "^\\d{4}-\\d{2}-\\d{2}T\\d{2}:\\d{2}:\\d{2}(?:\\.\\d+)?(?:Z|[+-]\\d{2}:\\d{2})$"}, "elapsedMs": {"type": "integer", "minimum": 1},
    "metrics": {"type": "object", "additionalProperties": false, "required": ["retries", "interventions", "conflictsDetected", "conflictsAutoResolved", "conflictsManualResolved", "conflictsUnresolved", "scopeViolations", "staleHeadEvents", "timeouts", "checkFailures", "checkReruns", "repairDispatches", "manualEdits"], "properties": {"retries": {"$ref": "#/$defs/count"}, "interventions": {"$ref": "#/$defs/count"}, "conflictsDetected": {"$ref": "#/$defs/count"}, "conflictsAutoResolved": {"$ref": "#/$defs/count"}, "conflictsManualResolved": {"$ref": "#/$defs/count"}, "conflictsUnresolved": {"$ref": "#/$defs/count"}, "scopeViolations": {"$ref": "#/$defs/count"}, "staleHeadEvents": {"$ref": "#/$defs/count"}, "timeouts": {"$ref": "#/$defs/count"}, "checkFailures": {"$ref": "#/$defs/count"}, "checkReruns": {"$ref": "#/$defs/count"}, "repairDispatches": {"$ref": "#/$defs/count"}, "manualEdits": {"$ref": "#/$defs/count"}}},
    "eventLedger": {"type": "object", "additionalProperties": false, "required": ["terminalHash", "firstSequence", "lastSequence"], "properties": {"terminalHash": {"$ref": "#/$defs/digest"}, "firstSequence": {"type": "integer", "minimum": 1}, "lastSequence": {"type": "integer", "minimum": 1}}},
    "finalGreenSha": {"anyOf": [{"$ref": "#/$defs/sha"}, {"type": "null"}]}, "terminalStatus": {"enum": ["green", "failed", "timed-out", "blocked", "incomparable"]}
  },
  "$defs": {
    "nonEmpty": {"type": "string", "minLength": 1, "maxLength": 4096, "pattern": "^(?!\\s)(?![\\s\\S]*\\s$)[\\s\\S]+$"}, "model": {"type": "string", "minLength": 1, "maxLength": 160, "pattern": "^(?!\\s)(?![\\s\\S]*\\s$)[\\s\\S]+$"}, "version": {"type": "string", "minLength": 1, "maxLength": 256, "pattern": "^(?!\\s)(?![\\s\\S]*\\s$)[\\s\\S]+$"}, "id": {"type": "string", "minLength": 1, "maxLength": 64, "pattern": "^[a-z0-9][a-z0-9._-]{0,63}$"}, "sha": {"type": "string", "pattern": "^[0-9a-f]{40}$"}, "digest": {"type": "string", "pattern": "^sha256:[0-9a-f]{64}$"}, "count": {"type": "integer", "minimum": 0},
    "effort": {"enum": ["low", "medium", "high", "xhigh", "max", "ultra"]},
    "controls": {"type": "object", "additionalProperties": false, "required": ["fixtureDigest", "specDigest", "startSha", "orderedStories", "orderedStorySetDigest", "acceptanceChecks", "acceptanceCheckDigest", "exactModel", "effortPolicyVersion", "initialEfforts", "handoffDigests", "nonModePlanDigest", "controllerVersion", "promptVersion", "codexVersion", "pythonVersion", "gitVersion", "os", "cpuCount", "concurrencyCeiling", "timeoutMs", "toolchainDigest", "environmentDigest"], "properties": {
      "fixtureDigest": {"$ref": "#/$defs/digest"}, "specDigest": {"$ref": "#/$defs/digest"}, "startSha": {"$ref": "#/$defs/sha"}, "orderedStories": {"type": "array", "minItems": 1, "maxItems": 128, "uniqueItems": true, "items": {"$ref": "#/$defs/id"}}, "orderedStorySetDigest": {"$ref": "#/$defs/digest"}, "acceptanceChecks": {"type": "array", "minItems": 1, "maxItems": 256, "uniqueItems": true, "items": {"$ref": "#/$defs/nonEmpty"}}, "acceptanceCheckDigest": {"$ref": "#/$defs/digest"},
      "exactModel": {"allOf": [{"$ref": "#/$defs/model"}, {"not": {"const": "inherit"}}]}, "effortPolicyVersion": {"$ref": "#/$defs/version"},
      "initialEfforts": {"type": "array", "minItems": 1, "maxItems": 128, "items": {"type": "object", "additionalProperties": false, "required": ["storyId", "effort"], "properties": {"storyId": {"$ref": "#/$defs/id"}, "effort": {"$ref": "#/$defs/effort"}}}}, "handoffDigests": {"type": "array", "minItems": 1, "maxItems": 128, "items": {"type": "object", "additionalProperties": false, "required": ["storyId", "digest"], "properties": {"storyId": {"$ref": "#/$defs/id"}, "digest": {"$ref": "#/$defs/digest"}}}}, "nonModePlanDigest": {"$ref": "#/$defs/digest"}, "toolchainDigest": {"$ref": "#/$defs/digest"}, "environmentDigest": {"$ref": "#/$defs/digest"},
      "controllerVersion": {"$ref": "#/$defs/version"}, "promptVersion": {"$ref": "#/$defs/version"}, "codexVersion": {"$ref": "#/$defs/version"}, "pythonVersion": {"$ref": "#/$defs/version"}, "gitVersion": {"$ref": "#/$defs/version"}, "os": {"$ref": "#/$defs/version"}, "cpuCount": {"type": "integer", "minimum": 1}, "concurrencyCeiling": {"type": "integer", "minimum": 1}, "timeoutMs": {"type": "integer", "minimum": 1}
    }}
  }
}
