{"arm":"parallel","attemptId":"sample-p1-par","controls":{"acceptanceCheckDigest":"sha256:c4773639e4181316df56e0a58dee27445b6eb0094737ee05682e81447055691f","acceptanceChecks":["All repository tests pass with a clean tree."],"codexVersion":"codex-cli 1.2.3","concurrencyCeiling":2,"controllerVersion":"compass-builder.controller.v1","cpuCount":8,"effortPolicyVersion":"plugin-compass.effort-policy.v1","environmentDigest":"sha256:1111111111111111111111111111111111111111111111111111111111111111","exactModel":"gpt-5.6-sol","fixtureDigest":"sha256:aaaaaaaaaaaaaaaaaaaaaaaaaaaaaaaaaaaaaaaaaaaaaaaaaaaaaaaaaaaaaaaa","gitVersion":"git version 2.51.0.windows.1","handoffDigests":[{"digest":"sha256:cccccccccccccccccccccccccccccccccccccccccccccccccccccccccccccccc","storyId":"alpha"},{"digest":"sha256:dddddddddddddddddddddddddddddddddddddddddddddddddddddddddddddddd","storyId":"beta"}],"initialEfforts":[{"effort":"low","storyId":"alpha"},{"effort":"medium","storyId":"beta"}],"nonModePlanDigest":"sha256:eeeeeeeeeeeeeeeeeeeeeeeeeeeeeeeeeeeeeeeeeeeeeeeeeeeeeeeeeeeeeeee","orderedStories":["alpha","beta"],"orderedStorySetDigest":"sha256:b30e0ba36ef12372de4d4385e1795ef8b561daa37e0bd9927fd2c9caaa7561e4","os":"Windows 11","promptVersion":"compass-builder.prompt.v1","pythonVersion":"3.11.9","specDigest":"sha256:bbbbbbbbbbbbbbbbbbbbbbbbbbbbbbbbbbbbbbbbbbbbbbbbbbbbbbbbbbbbbbbb","startSha":"aaaaaaaaaaaaaaaaaaaaaaaaaaaaaaaaaaaaaaaa","timeoutMs":600000,"toolchainDigest":"sha256:2222222222222222222222222222222222222222222222222222222222222222"},"elapsedMs":2300,"endedAt":"2026-09-01T12:00:02.300Z","eventLedger":{"firstSequence":1,"lastSequence":14,"terminalHash":"sha256:ffffffffffffffffffffffffffffffffffffffffffffffffffffffffffffffff"},"finalGreenSha":"bbbbbbbbbbbbbbbbbbbbbbbbbbbbbbbbbbbbbbbb","metrics":{"checkFailures":0,"checkReruns":0,"conflictsAutoResolved":0,"conflictsDetected":0,"conflictsManualResolved":0,"conflictsUnresolved":0,"interventions":0,"manualEdits":0,"repairDispatches":0,"retries":0,"scopeViolations":0,"staleHeadEvents":0,"timeouts":0},"pairNumber":1,"schemaVersion":"compass-builder.benchmark-receipt.v1","startedAt":"2026-09-01T12:00:00Z","terminalStatus":"green","trialNumber":1,"warmup":false,"workloadId":"sample"}
